wolf_part2_inperson_distress7 | Я попытаюсь выиграть вам еще несколько секунд, но он достигнет критической точки в любой момент.  Отойдите на безопасное расстояние как можно скорее, Капитан.  Спасите мой экипаж!
wolf_part2_objective_dock | Пристыковаться к UMC Orion Sentinel
wolf_part2_objective_dropoff | Высадить выживших на любой верфи или колонии [*X/*Y]
wolf_part2_objective_escape | Отойти на безопасное расстояние до взрыва Orion Sentinel
wolf_part2_objective_rescue | Спасти экипаж UMC Orion Sentinel [*X/40]
wolf_part2_objective_thrusters | Установить четыре маневровых двигателя на ваш корабль [*X/4]
wolf_part2_objective_visitharken | Отправиться к Командиру Харкену
wolf_part2_rescued | Спасено *X/*Y членов экипажа
wolf_part2_setup1 | Спасибо, что пришли, Капитан.
wolf_part2_setup2 | Мы пытались выследить пиратский корабль, но безуспешно. Мы продолжаем прибывать на место, чтобы найти уничтоженные корабли без следа пиратов. Нам нужно чтобы вы-
wolf_part2_setup3 | Это теперь срочная гуманитарная спасательная ситуация. Если мы отреагируем достаточно быстро, нам может просто повезти, и мы найдем экипаж, который сможем спасти.
wolf_part2_setup4 | Вам нужно будет приобрести как минимум четыре Маневровых двигателя для стыковки с кораблем Капитана Райкер.
wolf_part2_setup5 | Время истекает.  Отправьте корабль к Orion Sentinel и окажите любую помощь, которую можете, пока не стало слишком поздно.
wolf_part2_title | Волк В Овечьей Шкуре, Часть 2
wolf_part3_action_chargeemp | Зарядить ЭМИ
wolf_part3_action_triggeremp | Активировать ЭМИ
wolf_part3_advertisement1 | Капитан, мы разработали план, который, как мы полагаем, поймает пиратский корабль на месте преступления.
wolf_part3_advertisement2 | Пожалуйста, приезжайте к нам, и мы объясним цели миссии.
wolf_part3_combat1 | Капитан, мы в пути.  Мобилизуйте свой экипаж и установите эти оружейные системы как можно скорее.
wolf_part3_combat2 | Подкрепление идет.  Сдержите их еще несколько мгновений.
wolf_part3_combat3 | К сожалению, похоже, мы прибыли слишком поздно. Жертва вашего экипажа не будет забыта.
wolf_part3_combat4 | Целься в этот взрыв и огонь!
wolf_part3_debrief1 | Поздравляю, Капитан. Ваши действия в уничтожении Пиратского Корабля превзошли все ожидания!
wolf_part3_debrief2 | Ваше мастерство и храбрость не остались незамеченными. Я выражаю вам свою искреннюю благодарность за вашу помощь.
wolf_part3_debrief3 | В знак признательности считайте Astral Temptress теперь частью вашего флота.
wolf_part3_debrief4 | Корабль должен был быть утилизирован, но мы думаем, что у него может быть еще несколько лет в его конструкции.
wolf_part3_debrief5 | Прощайте, Капитан. Ваша преданность справедливости и безопасности нашего сектора не будет забыта.
wolf_part3_emp1 | Мы нашли их! Это наш шанс.
wolf_part3_emp2 | Зарядите оружие ЭМИ и приготовьтесь ударить их там, где это действительно больно. Пусть они подойдут ближе. Очень близко.
wolf_part3_emp3 | Они в радиусе действия! Активируйте ЭМИ от вашего Гипердвигателя сейчас!
wolf_part3_emptysystem1 | Эта система именно такая, где пираты могут атаковать.
wolf_part3_emptysystem2 | Продолжайте выглядеть занятым и отправляйтесь в другую пустую систему, пираты, должно быть, уже на вашем следу.
wolf_part3_episodesystem1 | Мы получили разведданные, что эта система слишком особенная, чтобы рисковать заманить сюда пирата.
wolf_part3_episodesystem2 | Старайтесь избегать систем с другой важной активностью.
wolf_part3_intro1 | Мы разработали план, который, как мы полагаем, поймает пиратский корабль на месте преступления.  Мы с ударным отрядом готовы привлечь их к ответственности, и нам нужна ваша помощь, чтобы организовать ловушку.
wolf_part3_intro2 | Это рискованная миссия, поможете ли вы нам?
wolf_part3_objective_chargeemp | Зарядить ЭМИ [*X%]
wolf_part3_objective_destroypirate | Уничтожить Пиратский Корабль
wolf_part3_objective_dockastral | Пристыковаться к Astral Temptress и укомплектовать корабль экипажем [*X/*Y]
wolf_part3_objective_getclose | Позволить пиратам подойти ближе
wolf_part3_objective_gotoharken | Отправиться к кораблю Командира Харкена
wolf_part3_objective_installweapons | Установить пушки и подключить их к энергосети. [*X/*Y]
wolf_part3_objective_jumparound | Прыгать на Astral Temptress в пустые системы до атаки
wolf_part3_objective_survive | Выжить до прибытия ударного отряда
wolf_part3_objective_triggeremp | Активировать ЭМИ
wolf_part3_otherships1 | В этой системе есть другие корабли. Пираты не нападут на вас, если не увидят грузовой корабль в одиночестве!
wolf_part3_otherships2 | Старайтесь избегать оживленных систем с колониями или верфями.
wolf_part3_ranaway1 | Мы почти их поймали! Ваше сотрудничество имеет решающее значение для успешного проведения этой операции.
wolf_part3_ranaway2 | Пираты, вероятно, все еще на вашем следу, думая, что вы испугались, прыгните в пустую систему, чтобы снова выманить их.
wolf_part3_setup1 | Капитан, пришло время привлечь этот пиратский корабль к ответственности за весь ущерб, который они нанесли, и за все жизни, которые они забрали.
wolf_part3_setup2 | UMC Astral Temptress - это приманка в нашей ловушке.  Это дальнобойный коммерческий грузовой корабль, который должен был быть утилизирован.  Мы хотим, чтобы вы взяли Astral Temptress и путешествовали по самым отдаленным, незащищенным местам в секторе.
wolf_part3_setup3 | Выглядите занятым, выглядите так, будто вы куда-то направляетесь, и выманите их из укрытия.  Они не смогут устоять перед такой легкой целью.
wolf_part3_setup4 | Чего они не осознают, так это того, что вы будете нести несколько тонн передовых военных оружейных систем, готовых к установке и активации в тот момент, когда они подойдут близко.
wolf_part3_setup5 | У нас есть финальный трюк, чтобы выиграть немного времени до прибытия подкрепления.  Мы можем перевернуть энергетическое поле в Гипердвигателе корабля и вызвать массивный всплеск энергии ЭМИ.  Достаточно, чтобы отключить их Гипердвигатель и предотвратить любую возможность побега.
wolf_part3_setup6 | Ваш собственный корабль тоже потеряет энергию - но в последующей суматохе у вас будет время установить ваши оружейные системы и подготовиться к тяжелой битве.
wolf_part3_setup7 | Вам придется сдерживать их пару минут.  Мой ударный отряд совершит боевую высадку практически на вас.  Затем ситуация повернется в нашу пользу.
wolf_part3_setup8 | Помните - пиратский корабль не покажется, если Astral Temptress не будет одна и невооружена. Удачной охоты!
wolf_part3_shipname_cargo | UMC Astral Temptress
wolf_part3_shipname_cargo_a10 | UMC Astral Accident
wolf_part3_shipname_frigate | UMC Celestial Hammer
wolf_part3_shipname_pirate | Pirate Vessel
wolf_part3_title | Волк В Овечьей Шкуре, Часть 3
wolf_part3_uninstallweapons1 | Пираты не клюнут на приманку, если увидят вас вооруженным!
wolf_part3_uninstallweapons2 | Демонтируйте ваше оружие перед следующим прыжком.
wolf_shipname_harken | UMC Vanguard
wolf_shipname_pirate | Unidentified Pirate
wolf_shipname_rescue | Orion Sentinel
wolf_shipname_scavenger | Scavenger Wraith
wolf_shipname_wolf1 | Interstellar Prospector
wolf_shipname_wolf2 | Infinite Horizon
wolf_shipname_wolf3 | Celestial Hauler
